{
  "artifact_id": "policy-episode-implementation-parity:f000477:education_workforce:119:v1",
  "authority_subject_sha256": "6381c88b1ee7e7e085e0ac9779616b58b93a5037ed3b19b5af7c56adb113b8a1",
  "authorizing": false,
  "generated_last": true,
  "implementation_subject_sha256": "1b11d068af95815952dee6877d8b97e5998539bfc56ddd0820e9b4b061688f3b",
  "parity_state": "pass",
  "parity_subject_sha256": "85fbc1567dcf4710a968143ae85ec3dc016d6407817913260fe9a1bb59588d1a",
  "public": false,
  "referenced_artifacts": [
    {
      "final_file_sha256": "dd84f769e2a2c7d547972d126f4aa5c5d272bd37a5308fbd2324a9926f91a299",
      "path": "docs/editorial/full_record_reviews/policy_episode_implementations/f000477_education_workforce_119_v1/human_policy_episode_authority.json"
    },
    {
      "final_file_sha256": "74212c3a768d33bb223bba81fbe92471d2ac698a10538e46d46c7683b3586f6e",
      "path": "docs/editorial/full_record_reviews/policy_episode_implementations/f000477_education_workforce_119_v1/episode_decision_implementation_bundle.json"
    },
    {
      "final_file_sha256": "07e3d93e23e0bfdffba28341caa977897810233b52cbde85226abaa19a16f056",
      "path": "docs/editorial/full_record_reviews/policy_episode_implementations/f000477_education_workforce_119_v1/implementation_dossier.md"
    },
    {
      "final_file_sha256": "94e7b5aab1d0ef0ec85c2a8806d8cd68994418a17b76e4d6a8d27008aee60806",
      "path": "docs/methodology/full_record_policy_episode_authority_v1.schema.json"
    },
    {
      "final_file_sha256": "e456b2cd525ee74d1561d4c86287bd141450617e995e3b7b767578b3936f244a",
      "path": "docs/methodology/full_record_policy_episode_decision_implementation_v1.schema.json"
    }
  ],
  "schema_version": "full_record_policy_episode_implementation_parity_v1"
}
